<?xml version="1.0" encoding="utf-8" standalone="yes"?>
<xs:schema
        attributeFormDefault="unqualified"
        elementFormDefault="qualified"
        xmlns:xs="http://www.w3.org/2001/XMLSchema"
        targetNamespace="http://homework.ru/home_library"
        >


    <xs:element name="home_library" type="home_library_type"/>

    <xs:complexType name="home_library_type">
        <xs:sequence>
            <xs:element name="authors" type="authors_type"/>
            <xs:element name="books" type="books_type"/>
        </xs:sequence>
    </xs:complexType>


    <xs:complexType name="authors_type">
        <xs:sequence>
            <xs:element name="author" type="author_type"/>
        </xs:sequence>
    </xs:complexType>

    <xs:complexType name="author_type">
        <xs:sequence>
            <xs:element name="author_name" type="author_name_type"/>
            <xs:element name="country" type="xs:string"/>
        </xs:sequence>
        <xs:attribute name="id" type="xs:ID"/>
    </xs:complexType>
    <xs:simpleType name="author_name_type">
        <xs:restriction base="xs:string">
            <xs:pattern value="w\.w\.w+"/>
        </xs:restriction>
    </xs:simpleType>

    <xs:complexType name="books_type">
        <xs:sequence>
            <xs:element name="book" type="book_type"/>
        </xs:sequence>
    </xs:complexType>

    <xs:complexType name="book_type">
        <xs:sequence>
            <xs:element name="id" type="xs:int"/>
            <xs:element name="name" type="xs:string"/>
            <xs:element name="id_author" type="xs:int"/>
            <xs:element name="genre" type="genre_type"/>
            <xs:element name="publish_year" type="xs:int"
                     minOccurs = "868" maxOccurs="unbounded"/>
        </xs:sequence>
        <xs:attribute name="id" type="xs:ID"/>
        <xs:attribute name="language" type="xs:string"/>
    </xs:complexType>

    <xs:simpleType name="genre_type">
        <xs:restriction base="xs:string">
            <xs:enumeration value="novel"/>
            <xs:enumeration value="poem"/>
            <xs:enumeration value="drama"/>
            <xs:enumeration value="fable"/>
            <xs:enumeration value="short story"/>
        </xs:restriction>
    </xs:simpleType>


</xs:schema>
